Name of credit card,Bank,Network,Annual Fee,Annual Fee Waiver,Joining Fee,Interest Rate,Cash Withdrawal Fee,Cash Advance Interest,Foreign currency transaction fee,Fuel Surcharge
ICICI Ferrari Signature Credit Card,ICICI,Visa,3999,"Rs.2,25,000","Rs.3,999 + GST",,,,,,"rewards-type : Premium, Lifestyle, Rewards, Travel, Fuel","Annual Fee (2nd year onwards) : Rs.3,999 + GST",Supplementary Card Fee : Nil
ICICI Ferrari Platinum Credit Card,ICICI,Visa,499,,Rs.499 (excluding GST),,,,,,Minimum spend for waiver of annual fee  : Rs.1.25 lakh ,Add-on card fee : Nil,"rewards-type : Lifestyle, Rewards, Travel, Fuel",Annual Fee (from second year) : Rs.499 (excluding GST)
ICICI Bank Coral Contactless Credit Card,ICICI,Visa,0,,,3.40% per month,,"2.50% of advanced amount, subject to a minimum of Rs.300",,,Cash payment at branches fee : Rs.100 per transaction,"Outstation cheque processing fee : 1% of cheque value, subject to a minimum of Rs.100",Charge slip fee : Rs.100 per slip,"Second Year Onwards Annual Fee : Rs.500 plus GST (Waived on spending Rs.1,50,000 or more)","Over-limit charge : 2.50% of over-limit amount, subject to a minimum of Rs.500",Redemption handling fee : Rs.99,Duplicate statement : Rs.100,"rewards-type : Lifestyle, Rewards, Travel","Auto-Debit return fee : 2% of amount due, subject to a minimum of Rs.450","Return cheque fee : 2% of amount due, subject to a minimum of Rs.450",Card replacement fee : Rs.100,"Late payment charge : Below Rs.100 - Nil
Rs.100 to Rs.500 - Rs.100
Rs.501 to Rs.10,000 - Rs.500
Above Rs.10,000 - Rs.750
"
ICICI Bank Rubyx Credit Card,ICICI,Master,3000,,,3.40% per month,,"2.50% of advanced amount, subject to a minimum of Rs.300",,,"Auto-Debit return fee : 2% of amount due, subject to a minimum of Rs.450","rewards-type : Lifestyle, Travel, Rewards","Over-limit charge : 2.50% of over-limit amount, subject to a minimum of Rs.500","Outstation cheque processing fee : 1% of cheque value, subject to a minimum of Rs.100",Duplicate statement : Rs.100,Charge slip fee : Rs.100 per slip,"Second year onwards annual fee : Rs.2,000 plus GST (Waived on spending Rs.3,00,000 and more)",Cash payment at branches fee : Rs.100 per transaction,"Return cheque fee : 2% of amount due, subject to a minimum of Rs.450",Redemption handling fee : Rs.99,"Late payment charge : Below Rs.100 - Nil
Rs.100 to Rs.500 - Rs.100
Rs.501 to Rs.10,000 - Rs.500
Above Rs.10,000 - Rs.750
",Card replacement fee : Rs.100
ICICI Sapphiro Credit Card,ICICI,Master,6500,,"Rs.6,500 (excluding GST)",,,2.5% on the advance amount for a minimum of Rs.300,,,Type of charges : Size of charges,Dial-a-draft transaction fee : 3% of the draft value amount for which one will have to pay a minimum fee of Rs.300,"rewards-type : Premium, Travel, Lifestyle","From Second year : Rs.3,500 (excluding GST)",Overlimit fee : 2.50% of the over-limit amount for which one would have to pay the minimum amount of Rs.500,Minimum card purchases for annual fee waiver : Rs.6 lakh
Jet Airways ICICI Bank Rubyx AMEX Credit Card,ICICI,AMEX,2500,,"Rs.2,500",,,,,,Overdue interest on extended credit and cash advances : 3.50% per month,"rewards-type : Travel, Rewards, Lifestyle, Fuel",Supplementary card fee : Rs.250
Jet Airways ICICI Bank Coral AMEX Credit Card,ICICI,AMEX,1250,,"Rs.1,250",,,,,,Supplementary card fee : Rs.250,"rewards-type : Travel, Rewards, Lifestyle, Fuel",Overdue interest on extended credit and cash advances : 3.50% per month (42% annualised)
Jet Airways ICICI Bank Sapphiro AMEX Credit Card,ICICI,AMEX,5000,,"Rs.5,000",,,,,,Add-On Card Fee : Rs.250,"rewards-type : Travel, Premium, Rewards, Lifestyle, Fuel",Type of charges : Size of charges,"Second Year : Rs.5,000"
Jet Airways ICICI Bank Coral VISA Credit Card,ICICI,Visa,1250,,"Rs.1,250 (Plus GST)",,,2.5% on the advance amount or Rs.300,,,Auto-debit return fee : 2% of full amount due (Minimum will have to be Rs.450.),"Late payment fee : When the unsettled amount is: Rs.100 to Rs.500: Rs.100
 Rs.501 to Rs.10,000: Rs.500 
Higher than Rs.10,000: Rs.750
","  :  ","Annual fee from second year : Rs.1,250 +GST (Waived on spends of Rs.3,00,000 and more).",Annual fee for supplementary card : Rs.250,Charge slip request : Rs.100 for each charge slip,Dial-a-draft transaction fee : 3% of the draft value amount for which you will have to pay a minimum fee of Rs.300,"rewards-type : Travel, Rewards, Lifestyle, Fuel"
Jet Airways ICICI Bank Rubyx VISA Credit Card,ICICI,Visa,2500,,"Rs.2,500 (Plus GST).",,,2.5% on the advance amount or a minimum of Rs.300.,Mark-up of 3.50% (1.5% goes to American Express in case of AE cards).,,Annual fee for Supplementary Card : Rs.250.,Charge slip request : Rs.100 for each charge slip.,Return of cheque fee : 2% of the full amount due (Minimum will have to be Rs.450).,Pick-up fee for cheque or cash : Rs.100 for each pick-up.,Dial-a-draft transaction fee : 3% of the draft value amount for which you will have to pay a minimum fee of Rs.300.,Overlimit fee : 2.50% of the over-limit amount or minimum of Rs.500.,"Annual fee from second year : Rs.2,500 (Plus GST).","rewards-type : Travel, Rewards, Lifestyle, Fuel"
Jet Airways ICICI Bank Sapphiro VISA Credit Card,ICICI,Visa,5000,,"Rs.5,000",,,,,,Overdue interest on cash advances or credit extensions : 3.50% per month,Type of charges : Size of charges,"From second year : Rs.5,000",Add-on Card Fee : Rs.250,"rewards-type : Travel, Premium, Rewards, Lifestyle, Fuel"
"Axis Bank Vistara Signature Credit Card
",Axis,Visa,3000,,,2.95% per month,,Rs.100,3.50% of the transacted amount,1% of the paid amount,Surcharge on railway tickets : Dictated by IRCTC,Re-issuing or replacement of card : Nil,"rewards-type : Premium, Travel, Rewards, Lifestyle",Charges involved : Size of the charges,Dishonour fee or cheque bounce : Rs.300,Alerts on registered mobile number or balance enquiry : Nil
Axis Bank Privilege Credit Card,Axis,Master,1500,,Rs.1500 (NIL for Priority Customers),2.95% per month,,Rs.100,3.50% of the transacted amount,1% of the amount,Re-issuing or replacement of card : NIL,Over limit penalty : Rs.500 or 3% of the over limit amount (whichever is higher),Charges involved : Amount,Dishonour fee or cheque bounce : Rs.300,"rewards-type : Rewards, Lifestyle, Fuel, Travel"
Axis Bank Vistara Credit Card | 15% Discount |Check Lounge Access & Limit,Axis,Visa,1500,,"Rs.1,500",2.95% per month (41.75% p.a.),,"2.5% of the amount withdrawn, subject to a minimum of Rs.250",3.5% of the transacted amount,,Outstation cheque : Waived,Re-issuing or replacement of lost or stolen card : Waived,"Penalty applicable for over-limit : 3% of the amount over limit, subject to a minimum of Rs.500",Copy request or chargeslip retrieval : Waived,Joining fee (add-on cardholder) : Nil,Annual fee from year-2 onwards (add-on cardholder) : Nil,Fee incurred for cash payments : Rs.100,Auto-debit reversal or fee involved in cheque return or dishonour : Rs.300,"rewards-type : Rewards, Travel, Lifestyle"
Axis My Zone Credit Card,Axis,Visa,500,,"Rs.500 (waived off on spends of Rs.5,000 within 45 days of the card issuance)",3.90% per month,"2.5% of the transaction amount or Rs.250, whichever is higher",,3.5% of the transaction value,,Over limit penalty fee : 3% of the over-limit amount or Rs.500,Cheque return or auto-debit reversal fee : Rs.300,Add-on card fee : NIL,Cash payment fee : Rs.100,Duplicate statement fee : NIL,"Late payment fee : If the statement balance is 
Up to Rs.100 – NIL
Rs.101 to Rs.300 – Rs.100
Rs.301 to Rs.1,000 – Rs.300
Rs.1,001 to Rs.5,000 – Rs.500
Rs.5,001 to Rs.20,000 – Rs.600
Rs.20,001 and above – Rs.700
",Type of Charge : Amount,"rewards-type : Rewards, Lifestyle, Fuel, Travel"
Axis Bank Neo Credit Card,Axis,Visa,250,,Rs.500,3.9% per month,,3.25% per month,3.5% of the transaction amount,,Hotlisting charges : NIL,Over limit penalty : 3% or a minimum of Rs.500 of the over limit amount.,"rewards-type : Lifestyle, Rewards",Type of fee  : Amount,Card replacement fee : Waived,"Late payment charges : Nil when the total due is up to Rs.100
Rs.100 if itis between Rs.101 - Rs.300
Rs.300 if it is between Rs.301 and Rs.1000
Rs.500 if it is between Rs.1,001 - Rs.5,000
Rs.600 if it is between Rs.5,001 - Rs.20,000
Rs.700 if it is Rs.20,001 and above
",Cash Payment Fee : Rs.100
Axis Bank Buzz Credit Card – 10% Discount on Flipkart,Axis,Master,750,,Rs.750,,,3.25% per month,3.50% of the transaction amount,,Hot listing fee : NIL,Cheque return fee : Rs.300,Balance inquiry fee : Waived,"Finance charges on overdue credit : 3.25% per month

",Add-on card fee : Nil,Cash payment fee at the branch : Rs.100,Duplicate statement fee : Waived,"Penalty on over-limit : 3% of the over-limit amount, subject to a minimum of Rs.500",Type of charge : Amount,Card replacement fee : Waived,Outstation cheque fee : Waived,"rewards-type : Lifestyle, Rewards"
Axis Bank Miles and More Credit Card ,Axis,Master,3500,,"World Select Credit Card – Rs.10,000
World Credit Card – Rs.3,500
",2.95% every month,2.5% (minimum Rs.250) of the amount,,3.50% of the total transaction value,,"Late payment fee or overdue penalty : If the total payment due is 
Up to Rs.2,000 – Rs.300
Between Rs.2,001 and Rs.5,000 - Rs.400
Rs.5,001 or more - Rs.600
",Charges for balance enquiry : Waived off,Types of charges : Amount,Annual fee for the add-on card : Nil,"Replacement of card (stolen, re-issued or lost) : NIL",Cash payment fee : Rs.100,Copy request fee or charge slip retrieval fee : NIL,Joining fee for the add-on card : Nil,Penalty for over limit : 3% of the over limit amount (minimum of Rs.500),"rewards-type : Rewards, Premium, Travel, Fuel",Fee for outstation cheque : Waived off,Auto-debit reversal or cheque return or dishonour fee  : Rs.300,Mobile alerts for the transactions : Waived off
Axis Bank MY Business Credit Card ,Axis,Visa,999,,Rs.999,,,,,,Description  : Amount ,rewards-type : ,Overlimit Fee : 3% of the over limit amount (Min.of Rs.500)
Axis Bank Signature Credit Card with Travel Benefits,Axis,,1500,,,,,,3.50% of the transaction value,,Charge of Mobile Alerts for Transactions : Waived,Add-on customer&rsquo;s charge for Priority Pass Program Membership : USD 99,Cash Payment Fee : 2.5% (Min. Rs 250) of the Cash Amount,"Card Replacement Fee if stolen, lost or re-issue : Waived","Emergency Card Replacement Fee, when overseas, through VISA : As per VISA Global Customer Assistance Services (GCAS)",Charges for Hotlisting : Waived,"Late Payment Fee or Overdue Penalty : &bull; If Total Payment Due is up to Rs. 2000, the fee will be Rs. 300&bull; If Total Payment Due is between Rs. 2001 - Rs. 5000, fee will be Rs. 400&bull; If Total Payment Due is Rs. 5001 or more, fee will be Rs. 600",Outstation Cheque Fee : Waived,"Fuel Transaction Surcharge : Rs. 10 or 2.5% of transaction amount, whichever is higher (Refunded for fuel transactions between Rs. 400 and Rs. 4000)",Standard sign-up fee : 5000 (3000 on special invite),Cash Withdrawal Fees : 2.5% (Min. Rs 250) of the Cash Amount,Fee for Duplicate Statement : Waived,Annual fee of Add-on Card : Nil,Finance Charges for Retail Purchases &amp; Cash : 41.75% annually (2.95% per month),Over limit Penalty : 3% of the over limit amount (Minimum Rs. 500),Charges : Signature Credit card with Travel Benefits,Joining fee of Add-on Card : Nil,Primary Card holder&rsquo;s charge for Priority Pass Program Membership : Free,Copy Request Fee or Charge slip Retrieval Fee : Waived,Charges for balance enquiry : Waived,rewards-type : Travel
Axis Bank Insta Easy Credit Card ,Axis,,Nil,,"Rs. 500 (it will be reversed if you spend Rs. 5,000 within 45 days of getting the card)",,,2.5 percent of the amount withdrawn (Minimum Rs 250),3.50 percent of the value of the transaction,,Finance Charges (Cash and Retail transactions : 2.50 percent per month or 34.49 percent p.a.,Fee for Duplicate Statement : None,Over limit fee : 3 percent of the over limit amount (Minimum Rs 500),Type of Fee : Amount charged,Add-on Card or Supplementary Card Joining Fee : None,Annual Fee for Supplementary or Add-on Card : None,Charges for Hotlisting : None,Cash Payment Fee : Rs 100,Cheque return Fee or Auto-debit reversal fee due to insufficient Funds : Rs 300,Balance Enquiry : None,rewards-type : ,Fee for Outstation Cheque : None
Axis Bank My Choice Credit Card,Axis,,Nil,,,,,,,,rewards-type : 
Axis Bank Titanium Smart Traveler Credit Card – Offers,Axis,,Nil,,"Rs. 250 (it is waived if you spend Rs. 5,000 within 45 days of receiving the card)",,,2 percent of the amount withdrawn (Minimum Rs 250),3.50 percent of the value of the transaction,,Fee for Duplicate Statement : None,Cash Payment Fee : Rs 100,Mobile Alerts : None,Over limit fee : 3 percent of the over limit amount (Minimum Rs 500),Balance Enquiry : None,Finance Charges for Retail &amp; Cash transactions : 3.25 percent per month or 46.78 percent p.a.,Fee for Outstation Cheque : Nil,Add-on Card or Supplementary Card Joining Fee : Rs 100,Annual Fee for Supplementary or Add-on Card : None,rewards-type : Travel,Fee Type : Amount
JetPrivilege HDFC Bank Diners Club Credit Card,HDFC,Diners Club International,10000,,,,,,,,Interest rate  : 1.99% per month ,Cash processing fee  : Rs.100 ,"Joining fee  : Rs.10,000 ","Outstation cheque processing charge  : Cheque value of up to Rs.5,000 – Rs.25 Cheque value of more than Rs.5,000 – Rs.50 ",Foreign currency transaction fee  : 3.5% ,Payment return charges  : 2% of payment amount (minimum Rs.450) ,"Annual fee  : Rs.5,000 ",Cash withdrawal fee  : 2.5% of the withdrawn amount (Minimum Rs.500) ,Rewards redemption fee  : Waived off ,"rewards-type : Travel, Premium, Rewards, Lifestyle, Fuel",Over limit charges  : 2.5% of the over-limit amount (minimum Rs.500) ,"Reissue of lost, stolen or damaged card  : Rs.100 "
HDFC Regalia Credit Card ,HDFC,Visa,2500,,,,,,,,"First year membership fee : Rs.2,500 + taxes","Renewal membership fee : Rs.2,500 + taxes",Fee for additional card : NIL,Charges for cash advance : 2.5% of the withdrawn amount subject to a minimum of or Rs.500,"Processing charge for Cheque (outstation) : Rs.25 for Cheque value of Rs.5,000. If the Cheque value is above Rs.5,000 then the fee is Rs.50",Foreign currency transactions : 2%,Revolving credit charges : 3.49% per month or 41.88% per annum,Fee for Rewards redemption : Rs.99 for every redemption request,Payment return charges : 2% of the payment amount subject to a minimum amount of Rs.450,Fee for cash processing : Rs.100,Fee for purchase of Railway tickets : 1.8% of the transaction amount + GST,"rewards-type : Premium, Travel, Rewards, Lifestyle, Fuel",Limit on cash advance : 40% of the total credit limit,Overlimit account charges : 2.5% of the overlimit amount subject to a minimum amount of Rs.500,"Processing charges for balance transfer : Rs.250 or 1% of the balance transfer amount, whichever is higher"
HDFC Bank Diners Club Black Credit Card ,HDFC,Diners Club International,5000,,,1.99% per month ,,,,,Payment return charges : 2% of the payment amount (Minimum of Rs.450),Over limit charges : 2.5% of the over the limit amount (Min. of Rs.500),Cash processing fee : Rs.100 per transaction,"Joining fee  : Rs.10,000 ",Rewards redemption fee : NIL ,"Renewal fee : Rs.5,000 ",Card re-issuance charges  : Rs.100 per instance ,"rewards-type : Premium, Rewards, Lifestyle, Travel, Fuel",Cash withdrawal fee  : 2.5% of the withdrawn amount (Minimum Rs.500),Add-on cards charges : NIL,Foreign currency mark-up fee  : 2%
HDFC Business Regalia Credit Card | HDFC Credit Cards,HDFC,Visa,2500,,,3.49% per month,,,,,Cash Processing Fee : Rs.100,Fee for outstation cheque processing : Up to Rs.50,Minimum Amount Due : 5% or Rs.200,Add-on card fee : NIL,Rewards Redemption Fee : Rs.99 per request,Cash Advance Limit : 40% of the credit limit,Interest-Free Period : Up to 50 days,"Cash Advance Charges : Rs.500 or 2.5% of withdrawn amount, whichever is higher",Card Re-issuance Fee : Rs.100,"Over Limit Charges : 2.5% of over limit amount, subject to a minimum of Rs.500","rewards-type : Rewards, Premium, Travel, Fuel, Lifestyle"
HDFC Regalia First Credit Card,HDFC,Visa,1000,,"Rs.1,000 ",,,2.5% of the withdrawn amount subject to a minimum of or Rs.500 ,2% ,,Payment return charges  : 2% of the payment amount subject to a minimum amount of Rs.450. ,Cash processing fee  : Rs.100 ,"Annual fee  : Rs.1,000 ","rewards-type : Rewards, Lifestyle, Travel, Fuel",Interest rate  : 3.49% per month ,Fee for additional card  : NIL ,Over limit charges  : 2.5% of the over limit amount subject to a minimum amount of Rs.500. ,Rewards redemption fee  : Rs.99 for every redemption request ,Card re-issuance charges  : Rs.100 
HDFC Diners ClubMiles Card,HDFC,Diners Club International,1000,,,,,,,,Over limit charges  : 2.5% of the over-limit amount (minimum Rs.500) ,"rewards-type : Rewards, Travel, Premium, Lifestyle, Fuel","Annual fee  : Rs.1,000 ",Cash withdrawal fee  : 2.5% of the withdrawn amount or Rs.500 ,Payment return charges  : 2% of payment amount (minimum Rs.450) ,"Joining fee  : Rs.1,000 ",Interest rate  : 3.49% per month ,Rewards redemption fee  : Rs.99 ,Cash processing fee  : Rs.100 ,"Reissue of lost, stolen or damaged card  : Rs.100 ",Foreign currency transaction fee  : 3.5% 
HDFC Business MoneyBack Credit Card | HDFC Credit Cards,HDFC,Visa,500,,,3.49% per month or 41.88% per annum,,,,,Minimum Amount Due : 5% or Rs.200,Cash Processing Fee : Rs.100,Interest-Free Period : Max. 50 days,"Over Limit Charges : 2.5% of over limit amount, subject to minimum of Rs.500",Cash Withdrawal Limit : 40% of the credit limit,"Cash Withdrawal Charges : 2.5% of withdrawn amount or Rs.500, whichever is higher",Rewards Redemption Fee : Rs.99 per request,Outstation Cheque Processing Fee : Up to Rs.50,Add-on card fee : NIL,Card Re-issuance Fee : Rs.100,"rewards-type : Rewards, Fuel, Lifestyle"
HDFC Bank MoneyBack Credit Card ,HDFC,Master,500,,Rs.500,,2.5% of the withdrawn amount (Minimum Rs.500),,3.5%,,Cash advance limit : 40% of the credit limit,Payment return charges : 2% of payment amount (minimum Rs.450),"Outstation cheque processing charge : Cheque value of up to Rs.5,000 – Rs.25 Cheque value of more than Rs.5,000 – Rs.50","rewards-type : Rewards, Lifestyle, Fuel",Interest rate  : 3.49% per month,Rewards redemption fee : Rs.99 per request,"Reissue of lost, stolen or damaged card : Rs.100",Over limit charges : 2.5% of the over-limit amount (minimum Rs.500),Cash processing fee : Rs.100
HDFC Bank Titanium Times Credit Card ,HDFC,Master,500,,Rs.500,3.49% per month,2.5% of the withdrawn amount (Minimum Rs.500),,3.5%,,Cash processing fee : Rs.100,Over limit charges : 2.5% of the over-limit amount (minimum Rs.500),Payment return charges : 2% of payment amount (minimum Rs.450),"Outstation cheque processing charge : Cheque value of up to Rs.5,000 – Rs.25 Cheque value of more than Rs.5,000 – Rs.50","Reissue of lost, stolen or damaged card : Rs.100",Cash advance limit : 40% of the credit limit,Rewards redemption fee : Rs.99 per request,"rewards-type : Lifestyle, Rewards, Fuel, Travel"
HDFC Bank Platinum Times Credit Card ,HDFC,Master,1000,,"Rs.1,000",3.49% per month,2.5% of the withdrawn amount (Minimum Rs.500),,3.5%,,Cash processing fee : Rs.100,"Reissue of lost, stolen or damaged card : Rs.100",Rewards redemption fee : Rs.99 per request,"Outstation cheque processing charge : Cheque value of up to Rs.5,000 – Rs.25 Cheque value of more than Rs.5,000 – Rs.50",Cash advance limit : 40% of the credit limit,Over limit charges : 2.5% of the over-limit amount (minimum Rs.500),Payment return charges : 2% of payment amount (minimum Rs.450),"rewards-type : Lifestyle, Rewards, Fuel, Travel"
HDFC Bank Snapdeal Credit Card ,HDFC,Visa,500,,Rs.500,,2.5% of the withdrawn amount (Minimum Rs.500),,3.5%,,Cash advance limit : 40% of the credit limit,"Outstation cheque processing charge : Cheque value of up to Rs.5,000 – Rs.25 Cheque value of more than Rs.5,000 – Rs.50",Cash processing fee : Rs.100,Payment return charges : 2% of payment amount (minimum Rs.450),"rewards-type : Rewards, Lifestyle, Fuel",Interest rate  : 3.49% per month,Over limit charges : 2.5% of the over-limit amount (minimum Rs.500),Rewards redemption fee : Rs.99 per request,"Reissue of lost, stolen or damaged card : Rs.100"
HDFC Bank Solitaire Credit Card ,HDFC,,500,,Rs.500,,2.5% of the withdrawal amount or a minimum of Rs.500,,,,Reward redemption fee : Rs.99 per redemption,rewards-type : Premium,Over credit limit fee : 2.5% on the amount the over limit amount. The minimum will be Rs.500. ,Railway ticket booking surcharge : 1.8% of the transaction value,Cash payment fee : Rs.100 per deposit,Interest rates : 3.49% per month,Re-issue of the card : Rs.100
Kotak Bank Royale Signature Credit Card ,Kotak Mahindra,Visa,0,,NIL,3.40% per month or 37.2% per annum,Rs.300,,3.50%,,Annual fee (paid variant) : Rs.999,Annual fee (free variant) : Rs.999,Card replacement charges : Rs.100,Add-on card fee : NIL,Credit card bill payment at bank branches : Rs.100,"rewards-type : Rewards, Travel, Fuel, Lifestyle",Cheque return charges : Rs.500,To get a copy of Credit Information Report (CIBIL) : Rs.50,Over limit charges : Rs.500,Reissue or replacement of the card : Rs.100
Kotak Bank PVR Platinum Credit Card ,Kotak Mahindra,Visa,999,,NIL,3.5%,,,3.5% of the transaction amount,,Over-limit charge : Rs.500,Add-on card fees : Rs.299 per add-on card,Outstation cheque processing fee : NIL,"rewards-type : Lifestyle, Rewards",Furnishing a copy of Credit Information Report (CIBIL) : Rs.50,Cash payment at bank fee : Rs.100,Card replacement (Reissue) fee : Rs.100,Cheque bounce charges : Rs.500
"Kotak Bank Essentia Platinum Credit Card | 6 free PVR tickets | 10% Off On Groceries
",Kotak Mahindra,Visa,1499,,"Rs.1,499",,,,,,Over limit fee : Rs.500,Interest charges on outstanding balances : 3.50% per month,"Cash withdrawal fee per Rs.10,000 or part thereof : Rs.300",Reissue or replacement of the card : Rs.100 (per issuance),"rewards-type : Lifestyle, Rewards",Add on card charges : Rs.299 per card,Furnishing a copy of CIBIL : Rs.50,Fee for cash payment at a branch of the bank : Rs.100
Kotak PVR Gold Credit Card ,Kotak Mahindra,Visa,499,,Nil,3.50%,,,3.5%,,"Rs.500-Rs.10,000 : Rs.500",Charges for over-limit : Rs.500,"rewards-type : Lifestyle, Rewards","Cash advance per Rs.10,000 or part thereof : Rs.300",Minimum Amount Due (MAD) : 5% or 10% (depends on the total amount due),"> Rs.10,000 : Rs.700",Providing a CIBIL report : Rs.50,Penalty for cheque bounce : Rs.500,Fees related to cash payments at the bank : Rs.100,Charges for reissuing of the card : Rs.100
Kotak Bank Delight Platinum Credit Card ,Kotak Mahindra,Visa,1999,,"Rs.1,999",3.40%,,,3.5%,,Penalty for Cheque Bounce : Rs.500,"Rs.500.01-Rs.10,000 : Rs.500","> Rs.10,000 : Rs.700",Charges for Over-limit : Rs.500,Fees related to cash payments at the bank : Rs.100,Providing a CIBIL report : Rs.50,Charges for reissuing of the card : Rs.100,Minimum Amount Due (MAD) : 5% or 10% (depends on the total amount due),"rewards-type : Lifestyle, Rewards"
Kotak Bank Privy League Visa Signature Credit Card,Kotak Mahindra,,5000,,The card is available in two variants with a joining fee of Rs.7500 and Rs.5000 respectively.,2.49%,,,3.50%,,Cash Withdrawal and Fund Transfer Charges : Rs.300,"rewards-type : Premium, LifeStyle",Late Payment Charges : Rs.100 to Rs.700 depending on the pending amount.,Over Limit Charges : Rs.500,Lost and Damaged card replacement fee : Rs.100
SBI SimplySAVE Credit Card,SBI Cards,Visa,499,,Rs.499,Up to 3.35% per month,,,3.5% of the transaction amount,,"Late payment fee : Total amount due Rs.0 to Rs.200 – NIL
Rs.201 to Rs.500 – Rs.100
Rs.501 to Rs.1,000 – Rs.400
Rs.1,001 to Rs.10,000 – Rs.600
Rs.10,001 to Rs.25,000 – Rs.800
Rs.25,001 and above – Rs.950
",Statement retrieval fee : Rs.100 per statement,Card replacement charge : Rs.100,"rewards-type : Rewards, Lifestyle, Fuel",Rewards redemption fee : Rs.99 per request,Payment dishonor fee : 2% of the payment amount or Rs.450,Over-limit fee : 2.5% of the over-limit amount or Rs.500
Yatra SBI Credit Card ,SBI Cards,Master,499,,,3.35% per month,,,3.5% of the transaction amount ,,Renewal fee : Rs.499 (from second year),Finance charges for Cash Advance : 3.35% per month,"Cheque fee : Rs.100 (for payments up to Rs.10,000)",Fee for Payment Dishonour  : 2% of the transaction amount,Annual fee  : Rs.499,Cash payment fee : Rs.100,Add-on fee : Nil ,Retrieval of Statement  : Rs.100 per statement ,Over-limit  : 2.5% for a minimum amount of Rs.500 ,Rewards redemption fee  : Rs.99,Type of fees and charges : Amount,Charge for Card Replacement  : Rs.100,"Fee for Late Payment   : Nil: Rs.0-Rs.200
Rs.100: Rs.201-Rs.500
Rs.400: Rs.501-Rs.1,000
Rs.600: Rs.1,001-Rs.10,000
Rs.800: Rs.10,001-Rs.25,000
Rs.950: Above Rs.25,000
","rewards-type : Travel, Rewards, Fuel"
SimplyClick SBI Card ,SBI Cards,Visa,499,,,,,,,,Joining fee  : Rs.499 ,Rewards redemption fee  : Rs.99 per request ,Payment dishonour fee  : 2% of the payment amount or Rs.450 ,Statement retrieval fee  : Rs.100 per statement ,Over-limit fee  : 2.5% of the over-limit amount or Rs.500 ,Card replacement charge  : Rs.100 ,"rewards-type : Rewards, Lifestyle, Fuel",Foreign currency transaction fee  : 3.5% of the transaction amount ,Type of fee or charge : Amount,Annual fee  : Rs.499 ,Interest rate  : Up to 3.35% per month ,"Late payment fee  : Total amount due Rs.0 to Rs.200 – NIL 
Rs.201 to Rs.500 – Rs.100 
Rs.501 to Rs.1,000 – Rs.400 
Rs.1,001 to Rs.10,000 – Rs.600 
Rs.10,001 to Rs.25,000 – Rs.800 
Rs.25,001 and above – Rs.950 
"
